{
  "id": "TP-cli-synth-command-001",
  "level": "unit",
  "capability": "Synth command execution with manifest resolution, account ID validation, and CDK assembly generation",
  "oracle": "exact",
  "invariants": [
    "Resolves explicit file path",
    "Uses fileDiscovery when file not provided",
    "Fails when account ID cannot be determined",
    "Generates valid CDK assembly"
  ],
  "fixtures": ["TempDir", "MockFileDiscovery", "MockSynthesizeService", "MockLogger"],
  "inputs": {
    "shape": "Synth command options (file, env, region, account)",
    "notes": "Uses temp directories for file I/O. Mocks synthesizeService. No actual CDK synthesis. No network I/O."
  },
  "risks": [],
  "dependencies": ["vitest", "@shinobi/core"],
  "evidence": [],
  "compliance_refs": [],
  "ai_generated": true,
  "human_reviewed_by": "platform-team"
}

