{
  "id": "TP-cli-catalog-command-001",
  "level": "unit",
  "capability": "Catalog command execution with component loading, enrichment, filtering, and output formatting",
  "oracle": "exact",
  "invariants": [
    "Loads component catalog correctly",
    "Enriches entries with creator information",
    "Filters by lifecycle (--all flag)",
    "JSON output format correct",
    "Human-readable output format correct",
    "Handles missing creators gracefully"
  ],
  "fixtures": ["TempDir", "MockComponentCatalog", "MockComponentCreators", "MockLogger"],
  "inputs": {
    "shape": "Catalog command options (all, json)",
    "notes": "Mocks component catalog and creator loaders. No file system operations. No network I/O."
  },
  "risks": [],
  "dependencies": ["vitest", "@shinobi/core"],
  "evidence": [],
  "compliance_refs": [],
  "ai_generated": true,
  "human_reviewed_by": "platform-team"
}

