{
  "id": "TP-cli-diff-command-001",
  "level": "unit",
  "capability": "Diff command execution with CloudFormation template comparison",
  "oracle": "exact",
  "invariants": [
    "Returns changes when stack does not exist",
    "Returns exit code 0 when templates match",
    "Exit codes correct (0 no changes, 3 changes detected)"
  ],
  "fixtures": ["MockCloudFormationClient", "MockSynthesizeService", "MockLogger", "MockFileDiscovery"],
  "inputs": {
    "shape": "Diff command options (file, env, region, account, output)",
    "notes": "Mocks CloudFormation client and synthesizeService. No network I/O. No actual AWS calls."
  },
  "risks": [],
  "dependencies": ["vitest", "@aws-sdk/client-cloudformation"],
  "evidence": [],
  "compliance_refs": [],
  "ai_generated": true,
  "human_reviewed_by": "platform-team"
}

