{
  "id": "TP-cli-composition-root-001",
  "level": "unit",
  "capability": "Composition Root dependency injection and command factory creation",
  "oracle": "exact",
  "invariants": [
    "Dependencies are singletons (cached)",
    "All command factories return valid instances",
    "Logger.platformLogger used for core services",
    "Full object graph can be instantiated"
  ],
  "fixtures": ["CompositionRoot"],
  "inputs": {
    "shape": "Logger configuration options (verbose, ci)",
    "notes": "Pure unit tests with no I/O. Tests dependency injection pattern."
  },
  "risks": [],
  "dependencies": ["vitest", "@shinobi/core"],
  "evidence": [],
  "compliance_refs": ["std://platform-component-api-spec"],
  "ai_generated": true,
  "human_reviewed_by": "platform-team"
}

