{
  "id": "TP-cli-console-logger-001",
  "level": "unit",
  "capability": "Console logger configuration, logging, and formatting behavior",
  "oracle": "exact",
  "invariants": [
    "Logger configurable via configure()",
    "Logs captured for testing",
    "CI mode uses structured JSON",
    "Non-CI mode uses human-readable emoji",
    "Debug/trace only log when verbose=true"
  ],
  "fixtures": ["MockLogger", "ConsoleSpies"],
  "inputs": {
    "shape": "Logger configuration options (verbose, ci, serviceName, etc.)",
    "notes": "Tests use vi.spyOn to mock console methods. No network I/O. No clock dependencies."
  },
  "risks": [],
  "dependencies": ["vitest", "@shinobi/core"],
  "evidence": [],
  "compliance_refs": ["std://platform-logging-standard"],
  "ai_generated": true,
  "human_reviewed_by": "platform-team"
}

