{
  "id": "TP-cli-up-command-001",
  "level": "unit",
  "capability": "Up command execution with stack deployment, confirmation prompts, and CDK integration",
  "oracle": "exact",
  "invariants": [
    "Deploys stack successfully",
    "Skips deploy when confirmation rejected",
    "Exit codes correct (0 success, 2 failure)"
  ],
  "fixtures": ["MockAwsCdkCli", "MockInquirer", "MockSynthesizeService", "MockLogger", "MockFileDiscovery"],
  "inputs": {
    "shape": "Up command options (file, env, region, account, yes, json)",
    "notes": "Mocks CDK CLI, inquirer prompts, and synthesizeService. No network I/O. No actual AWS calls."
  },
  "risks": [],
  "dependencies": ["vitest", "@aws-cdk/cli-lib-alpha", "inquirer"],
  "evidence": [],
  "compliance_refs": [],
  "ai_generated": true,
  "human_reviewed_by": "platform-team"
}

