{
  "id": "TP-application-generator-behavior-001",
  "level": "unit",
  "capability": "Application generator skill structure and behavior validation",
  "oracle": "exact",
  "invariants": [
    "Skill directory structure exists",
    "SKILL.md contains required sections",
    "Reference documentation exists",
    "Scripts are executable"
  ],
  "fixtures": ["ApplicationGeneratorSkill"],
  "inputs": {
    "shape": "Skill directory structure",
    "notes": "Validates skill follows platform skill patterns"
  },
  "risks": [],
  "dependencies": ["@shinobi/core", "vitest"],
  "evidence": ["Directory structure", "File existence checks"],
  "compliance_refs": ["skills/skill-architect/SKILL.md"],
  "ai_generated": true,
  "human_reviewed_by": "platform-team"
}

