{
  "id": "TP-cli-validate-command-001",
  "level": "unit",
  "capability": "Validate command execution with manifest discovery, validation, and output formatting",
  "oracle": "exact",
  "invariants": [
    "Manifest discovery works with --file option",
    "Manifest discovery works without --file option",
    "Returns exitCode 0 on success",
    "Returns exitCode 2 on failure",
    "JSON mode suppresses human output"
  ],
  "fixtures": ["TempDir", "MockFileDiscovery", "MockPipeline", "MockLogger"],
  "inputs": {
    "shape": "Validate command options (file, json)",
    "notes": "Uses temp directories for file I/O. Mocks file discovery and validation pipeline. No network I/O."
  },
  "risks": [],
  "dependencies": ["vitest", "@shinobi/core"],
  "evidence": [],
  "compliance_refs": ["std://platform-configuration-standard"],
  "ai_generated": true,
  "human_reviewed_by": "platform-team"
}

