{
  "id": "TP-cli-plan-command-001",
  "level": "unit",
  "capability": "Plan command execution with caching, JSON output, and warning handling",
  "oracle": "exact",
  "invariants": [
    "Uses cached execution context",
    "JSON output includes resolvedManifest, warnings, structuredData",
    "Warnings surfaced correctly",
    "Structured output in JSON mode"
  ],
  "fixtures": ["TempDir", "MockExecutionContext", "MockLogger"],
  "inputs": {
    "shape": "Plan command options (file, env, json)",
    "notes": "Mocks execution context manager. No network I/O. No file system operations."
  },
  "risks": [],
  "dependencies": ["vitest", "@shinobi/core"],
  "evidence": [],
  "compliance_refs": [],
  "ai_generated": true,
  "human_reviewed_by": "platform-team"
}

